query_id,query
708,"What strategies can blood donation facilitation programs employ to recruit and retain diverse donors, including individuals from underrepresented or marginalized communities?"
709,"What impact do donor recognition programs, such as milestone awards and personalized thank-you messages, have on donor retention and loyalty, and how do blood donation organizations implement these programs effectively?"
710,What are the potential ethical considerations and social implications of commercializing blood donation or incentivizing blood donors through monetary compensation or non-monetary rewards?
711,What are some common myths or misconceptions about blood donation?
712,What role does public awareness and advocacy campaigns play in mobilizing support for youth blood donation initiatives?
713,What strategies can be employed to encourage regular blood donation among first-time donors in Ethiopia and convert them into repeat donors?
714,How do blood donation programs tailor their outreach and messaging to effectively engage with culturally and linguistically diverse communities?
715,What measures are taken to address concerns related to blood donor safety and adverse reactions during the donation process?
716,How do donation preferences differ between different cultural or ethnic groups?
717,How can donating blood offer a meaningful experience?
718,What strategies can be implemented to address language and cultural barriers in donor recruitment and communication efforts in Africa?
719,What strategies can blood centers employ to prioritize the recruitment of donors during specific times of year or seasonal campaigns?
720,"How can partnerships between local governments, international organizations, and non-profit entities help address the challenges faced by transfusion services in sub-Saharan Africa?"
721,How can individuals benefit from reducing added sugars for successful blood donation?
722,How do blood drive hosts tailor their outreach efforts to engage specific cultural or ethnic communities?
723,What role do cultural attitudes and beliefs play in shaping blood donation behavior?
724,"How do blood donation organizations collaborate with local media outlets, newspapers, and radio stations to raise awareness about blood donation events, share success stories, and encourage community participation?"
725,What educational resources are provided to potential blood donors to inform them about the donation process?
726,"Question 65 How do socioeconomic disparities affect access to blood transfusion services in Ethiopia, and what measures can be taken to promote equity?"
727,"What impact do workplace donation challenges, team-building activities, or corporate social responsibility initiatives have on increasing employee participation, building morale, and strengthening relationships within organizations?"
728,How do blood donation facilitation programs collaborate with transportation providers and logistics companies to optimize the distribution of blood products and ensure timely delivery to healthcare facilities?
729,"How do blood donation centers leverage social media platforms, digital marketing"
730,How do blood donation programs collaborate with local governments and public health agencies to promote blood donation as a community health priority?
731,What role do educational campaigns and blood donor drives play in increasing donation rates among younger demographic groups?
732,How can individuals benefit from limiting alcohol consumption for successful blood donation?
733,How can blood donation facilitation programs engage with schools and universities to encourage young donors to participate?
734,Question 94 What measures can be implemented to ensure the safety and quality of blood transfusions in rural areas of Ethiopia with limited healthcare infrastructure?
735,How do blood drive hosts adapt their donation strategies to accommodate the needs of older adults and individuals with mobility limitations?
736,Question 7 How can partnerships between blood transfusion services and other healthcare providers enhance patient care and blood management?
737,How do blood donation centers ensure that donors have a positive experience during the donation process?
738,"What are some of the key barriers to voluntary blood donation in northern and western Tanzania, as identified by research studies?"
739,What strategies can blood donation facilitation programs employ to encourage donors to make regular donations and become part of a sustainable donor pool?
740,How does poor appointment-keeping behavior among repeat blood donors affect their intention to donate again?
741,What role do community-based partnerships and collaborations play in supporting blood donation efforts and expanding outreach to diverse populations?
742,"What role do cultural festivals, community events, and religious holidays play in promoting blood donation awareness, reaching diverse audiences, and encouraging participation in donation efforts?"
743,How can blood donation help maintain healthy blood pressure?
744,"What role can virtual donation events and online campaigns play in prioritizing donation awareness and engagement, particularly in times of crisis or when in-person gatherings are limited?"
745,How can health institutions utilize female health care professionals' influence to advocate for blood donation in the community?
746,"What initiatives can blood donation centers undertake to address donor apathy, complacency, or disengagement over time, rekindling interest, enthusiasm, and commitment to donation activities?"
747,How can health organizations use female health care professionals as advocates for blood donation?
748,How can local government agencies support blood donation initiatives?
749,What role do volunteer donors play in meeting the demand for blood products?
750,"How can blood donation organizations address cultural and religious barriers to donation, such as misconceptions, beliefs, or practices that may discourage participation among certain demographic groups?"
751,How can workplaces support blood donation practices among employees?
752,"How do blood donation organizations partner with disaster response agencies, emergency management organizations, and humanitarian relief efforts to secure blood product availability for emergency transfusions during natural disasters, conflicts, and other humanitarian crises?"
753,"How can blood centers prioritize the recruitment of donors who are willing to participate in regular blood donation campaigns, such as the Power Red program?"
754,"What measures can blood donation centers take to address vaccine-related concerns among donors, particularly during public health campaigns?"
755,How can peer-led initiatives improve blood donation participation?
756,What strategies can be employed to prioritize the recruitment and retention of first-time blood donors?
757,How can blood donation centers use appointment reminder messages to educate donors about the importance of regular donation and the impact of their contributions?
758,What measures can be implemented to address the shortage of blood collection equipment and supplies in Tanzania?
759,"How can donor recruitment efforts be tailored to prioritize donation among specific age groups, such as millennials or seniors, and address generational attitudes and preferences towards donation?"
760,What role do religious institutions play in promoting or inhibiting blood donation efforts in Tanzania?
761,How do blood donation centers address concerns related to the collection and use of convalescent plasma during public health emergencies?
762,How have changes in donation site locations and blood shortage messaging impacted donor demographics?
763,Question 14 How can partnerships with corporate entities and businesses contribute to sustaining blood donation programs and increasing donor participation?
764,"What innovative mobile applications and digital platforms exist to facilitate blood donation, donor registration, and appointment scheduling?"
765,How can blood donation centers collaborate with environmental organizations and sustainability advocates to promote donation as an eco-friendly and socially responsible practice?
766,How can blood banks use donor feedback to improve automated blood collection practices?
767,What are the potential advantages of using ABC over traditional blood donation methods?
768,Question 61 What role can religious institutions play in promoting voluntary blood donation and dispelling misconceptions in Ethiopian communities?
769,Question 40 What role can community-based organizations and grassroots movements play in mobilizing volunteer blood donors in Africa?
770,"What impact do peer-to-peer fundraising campaigns and donor referral programs have on expanding the donor base, increasing donation frequency, and fostering a sense of community engagement in blood donation efforts?"
771,"What strategies can be employed to prioritize the recruitment of donors from military and veteran communities, recognizing their commitment to service and sacrifice?"
772,How can blood centers prioritize the recruitment of donors who are willing to participate in innovative research studies to advance transfusion medicine?
773,How do cultural beliefs and perceptions about blood donation vary across different regions or ethnic groups?
774,"What measures can be taken to prioritize the recruitment of donors from the tech and innovation sector, recognizing their potential to drive technological advancements in blood banking and support donation efforts through digital platforms and solutions?"
775,"How does the program address concerns related to the ethical implications of youth blood donation, such as informed consent and voluntariness?"
776,How can blood centers leverage donor loyalty programs and retention strategies within an online blood donation management system to cultivate long-term relationships and sustained engagement?
777,"What are the potential benefits and challenges of implementing mobile blood donation clinics in rural or remote areas, and how can these challenges be addressed?"
778,"What strategies can be implemented to address common misconceptions and myths about blood donation, such as fears of pain, needles, or eligibility criteria?"
779,How can blood centers prioritize the development of targeted marketing and outreach campaigns to attract specific donor demographics?
780,How can blood donation centers utilize behavioral insights and principles of persuasion to optimize the effectiveness of appointment reminder messages?
781,What role does donor education play in promoting the use of appointment scheduling systems and encouraging proactive donation behavior?
782,What role do corporate partnerships and sponsorships play in supporting blood donation centers?
783,Can you discuss the importance of donor diversity in ensuring the availability of compatible blood products for patients from diverse ethnic and racial backgrounds?
784,"How can universities address the challenge of donor recruitment and retention among international students, who may face unique barriers or cultural considerations related to blood donation?"
785,"How can blood donation centers utilize virtual engagement platforms and digital communication tools to connect with donors, host virtual donation events, and provide ongoing support and engagement opportunities in a remote or socially distanced environment?"
786,How does blood donation enhance self-awareness?
787,How do blood donation centers leverage technology and digital platforms to engage with donors and promote donation awareness?
788,"What role can schools and educational institutions play in prioritizing blood donation among students and young adults, and how can donation programs be integrated into educational curricula?"
789,How can blood donation impact individuals with chronic fatigue syndrome?
790,How can the interval between blood donations be optimized?
791,"What role can student governments or student unions play in advocating for blood donation awareness, organizing events, and mobilizing student participation on campus?"
792,"How do blood drive hosts collaborate with local chambers of commerce, business associations, or economic development agencies to promote blood donation as a community engagement initiative, support economic vitality, and strengthen social bonds among businesses, residents, and stakeholders?"
793,What measures can blood donation facilitation programs take to address concerns related to vaccine hesitancy or misinformation and reassure potential donors about the safety of donation?
794,What strategies can blood donation centers employ to ensure that appointment reminder messages comply with privacy regulations and data protection laws?
795,What communication tools are available for donors and blood centers in an online blood donation management system?
796,"How do socioeconomic factors, such as poverty or lack of education, impact access to blood transfusion services in Tanzania?"
797,What strategies can blood donation centers use to ensure equitable access to appointment scheduling services for donors from rural or remote areas?
798,What role do donor recognition programs and appreciation events play in fostering donor loyalty and retention?
799,How can appointment reminders be integrated with other donor engagement initiatives to enhance overall donor satisfaction?
800,"How can universities collaborate with national health authorities to implement standardized training programs for healthcare professionals involved in blood collection, processing, and transfusion?"
801,What strategies can blood donation facilitation programs use to encourage peer-to-peer recruitment and word-of-mouth promotion?
802,"Can you discuss the importance of continuous donor education and training programs in ensuring donor safety, adherence to protocols, and the quality of donated blood?"
803,"How can universities support the mental and emotional well-being of blood donors by providing counseling services, peer support groups, or debriefing sessions?"
804,What role can celebrity endorsements and influencer partnerships play in raising awareness about blood donation and inspiring public participation?
805,What role does donor retention play in the sustainability and success of blood donation facilitation programs?
806,How do blood donation centers ensure the safety and quality of donated blood products?
807,What impact can university-led blood donation initiatives have on reducing blood shortages and meeting the healthcare needs of underserved populations?
808,"What role do blood donation organizations play in supporting research and development efforts to improve blood processing, storage, and transfusion practices, and how do they contribute to advancements in transfusion medicine?"
809,"How do blood donation centers incorporate principles of diversity, equity, and inclusion into their organizational culture, policies, and practices, ensuring representation, respect, and belonging for donors, staff, and volunteers from historically marginalized or underrepresented communities?"
810,Question 42 What measures can be implemented to address the specific needs and concerns of marginalized or vulnerable populations in blood donation programs?
811,What role do community health workers and outreach volunteers play in promoting blood donation awareness and education in underserved areas?
812,How do perceptions of donation convenience and accessibility influence donation behavior?
813,How can blood donation impact individuals with chronic obstructive pulmonary disease (COPD)?
814,How do public health campaigns and advocacy efforts contribute to shaping public attitudes towards blood donation and promoting donation as a civic responsibility?
815,What measures can blood donation centers implement to ensure transparency and accountability in the appointment scheduling process?
816,How can health education programs contribute to blood donation awareness?
817,"How do demographic factors, such as age, gender, and socioeconomic status, influence blood donation behavior?"
818,How do appointment reminders contribute to promoting donor retention and loyalty?
819,How can blood donation facilitation programs leverage data analytics and technology to optimize their donor recruitment and engagement strategies?
820,How does the lack of public awareness about blood transfusion needs and procedures contribute to low donation rates in Ethiopia?
821,What strategies can be employed to encourage repeat blood donation among individuals in Ethiopia?
822,How can blood centers leverage data analytics and predictive modeling to anticipate future demand for blood products and optimize inventory management?
823,What role do appointment reminder systems play in improving appointment adherence and reducing missed appointments?
824,What role do family and peer networks play in shaping attitudes toward blood donation?
825,What role can governmental policies and regulations play in incentivizing blood donation and ensuring the safety of donated blood in Ethiopia?
826,How can health institutions encourage female health care professionals to participate in community blood drives?
827,How can blood donation centers collaborate with student organizations and campus clubs to organize donation events and campaigns that engage college students and foster a culture of philanthropy and community service?
828,What measures can be implemented to enhance the safety and quality of blood collection procedures in Ethiopia?
829,How do blood donation centers utilize appointment reminders to optimize donation appointments?
830,"How do blood transfusion services in Tanzania ensure compliance with international standards and best practices in blood donation, processing, and transfusion?"
831,What strategies can be implemented to enhance the accessibility and convenience of blood donation facilities and services?
832,How do blood drive hosts collaborate with local media outlets to promote donation events and share success stories?
833,"How do blood donation organizations collaborate with disaster response agencies, emergency management organizations, and humanitarian relief efforts to ensure the availability of blood products for emergency transfusions during natural disasters, conflicts, and other humanitarian crises?"
834,"Question 75 How do geographic disparities in healthcare infrastructure and access affect blood donation rates in Ethiopia, and what strategies can be implemented to address these disparities?"
835,What measures can be implemented to address language barriers and improve communication in blood donation campaigns and donor recruitment efforts in Tanzania?
836,What are some examples of nonmonetary incentives used in blood donation facilitation programs?
837,How can blood donation benefit individuals with diabetes?
838,"What impact do media representations of blood donation, such as news coverage or fictional portrayals, have on public perceptions and behaviors?"
839,How can appointment reminders be optimized to encourage donors to share their appointment status or preferences?
840,"Question 68 What role does government policy and investment play in supporting the sustainability of blood transfusion services in Ethiopia, and what policy reforms are needed?"
841,How does the COVID-19 pandemic impact the eligibility criteria for blood donors in Africa?
842,"How can mobile blood donation drives and pop-up donation sites contribute to reaching diverse donor populations, increasing donation rates, and addressing specific community needs?"
843,What role can gamification techniques play in incentivizing blood donation and fostering a sense of community engagement among donors?
844,"How do donor recruitment strategies leverage digital technologies, social media platforms, and online communities to reach and engage potential donors, particularly younger generations?"
845,How do blood donation centers ensure the equitable representation of diverse populations in donor recruitment and outreach efforts?
846,"How do blood donation organizations ensure the safety and quality of donated blood products through rigorous screening, testing, and processing procedures?"
847,How can blood donation facilitation programs leverage partnerships with sports organizations or events to encourage donation participation?
848,How do blood transfusion services in Tanzania collaborate with international organizations and donors to strengthen blood safety and availability?
849,"What role do blood donation organizations play in promoting public health initiatives, such as vaccination campaigns and disease prevention efforts, and how do they collaborate with public health agencies to support these initiatives?"
850,How do blood drive hosts incorporate elements of gamification or friendly competition to motivate donors and increase engagement during donation events?
851,What strategies can blood centers employ to prioritize the recruitment of donors who are willing to participate in platelet donation programs?
852,How can individuals manage stress to support healthy blood donation?
853,In what ways can studies focusing on donor segmentation based on preferences help shape strategies for prioritizing blood donors within expansive urban locales?
854,How can blood donation centers leverage donor preferences and feedback to tailor appointment scheduling processes?
855,How can individuals benefit from avoiding excessive salt intake before blood donation?
856,What strategies can be employed to optimize appointment scheduling during peak donation periods?
857,"How do blood donation centers collaborate with healthcare providers, clinical laboratories, and transfusion specialists to optimize patient care, ensure appropriate transfusion practices, and promote evidence-based decision-making in transfusion medicine?"
858,What role do social media influencers and online communities play in raising awareness about blood donation?
859,"How do blood drive hosts collaborate with local healthcare providers, medical professionals, or patient advocacy groups to raise awareness about blood donation, educate patients about transfusion options, and ensure a reliable supply of blood products for patient care?"
860,How does the lack of standardized data collection and reporting systems impact the monitoring and evaluation of blood transfusion services in Africa?
861,How does an online blood donation management system enhance the efficiency of blood centers?
862,"How do blood donation centers incorporate feedback mechanisms, satisfaction surveys, and donor testimonials into their quality improvement processes, ensuring responsiveness to donor needs, preferences, and concerns, and driving continuous enhancement of service delivery and donor engagement strategies?"
863,"What strategies can blood donation organizations employ to engage with donors who may have concerns or questions about the donation process, eligibility criteria, or potential side effects, and how do they provide information and support to address these concerns?"
864,How do mobile blood donation units impact donation rates in underserved areas?
865,"How do blood donation organizations collaborate with professional associations, industry partners, and regulatory agencies to establish standards, guidelines, and best practices for blood collection, processing, and transfusion?"
866,How can individuals benefit from consuming more water-rich foods for blood donation?
867,How does the community-based blood donation program aim to encourage youth to donate blood?
868,"How do blood donation facilitation programs address the unique needs and preferences of donors from different age groups, backgrounds, and cultural or religious traditions?"
869,How does the lack of coordination and collaboration among stakeholders in the blood donation ecosystem impact overall donation efforts in Ethiopia?
870,What steps are taken to minimize wait times for donors at blood donation centers?
871,"Question 51 How can community-based blood donation events, such as blood drives hosted by local businesses or religious organizations, contribute to increasing donor participation?"
872,How can individuals benefit from increasing their intake of lean proteins for donation?
873,How do blood donation centers collaborate with blood banks and transfusion services to coordinate regional and national blood supply efforts?
874,What role can universities play in fostering interdisciplinary collaborations and partnerships to address complex health challenges such as blood donation in Ethiopia?
875,"Question 42 What measures can be taken to promote donation among individuals who may have concerns about needle phobia or anxiety related to the donation process, and how can donation centers provide support and accommodations to ensure a positive experience for these donors?"
876,What is the role of research in advancing automated blood collection practices?
877,How can individuals manage stress and fatigue while recovering from blood donation?
878,What role does donor education play in promoting automated blood collection?
879,"How do blood donation centers adapt their donor recruitment and retention strategies to align with changing demographics and societal trends, such as an aging population or increased urbanization?"
880,"How do blood donation centers leverage technology and digital platforms to enhance donor recruitment, engagement, and communication strategies?"
881,What role do educational campaigns and outreach initiatives play in dispelling myths and misconceptions about blood donation?
882,"How do blood donation organizations collaborate with sports teams, athletic organizations, and fitness communities to promote blood donation as a healthy and altruistic activity and encourage athletes and fitness enthusiasts to participate in donation drives?"
