query_id,query
1423,What role does innovation in blood storage and transportation technology play in ensuring the quality and safety of blood products?
1424,How can blood donation campaigns be improved through the use of technology?
1425,How might blood donation impact an individual's ability to perform household chores?
1426,"How can universities collaborate with local health authorities, community clinics, and hospitals to establish blood donor registries, organize donation events, and ensure the efficient distribution of blood products to patients in need?"
1427,What role do community-based organizations and grassroots movements play in promoting blood donation?
1428,How can donating blood provide a sense of fulfillment?
1429,"What are the challenges associated with recruiting and retaining blood donors from rural or remote areas, and how can blood donation centers overcome these challenges?"
1430,How can health organizations address female health care professionals' concerns about balancing work responsibilities and blood donation?
1431,How can ABC enhance the experience of repeat blood donors?
1432,"How do appointment scheduling systems integrate with other donor management platforms, such as electronic health records or blood inventory systems?"
1433,Can you discuss the role of traditional healers and medicine practitioners in influencing perceptions of blood donation and transfusion in Tanzania?
1434,"How do blood transfusion services collaborate with national health authorities and regulatory agencies to develop and enforce standards for blood collection, processing, and transfusion in Tanzania?"
1435,How can partnerships with local media enhance blood donation campaigns?
1436,How do blood donation programs collaborate with educational institutions and corporate partners to organize donation drives and promote a culture of blood donation?
1437,What factors contribute to the prioritization of emerging infectious disease agents in transfusion safety?
1438,"How do blood drive hosts utilize data analytics and donor management systems to optimize donation strategies, track donor trends, and improve outreach efforts?"
1439,"What measures are in place to ensure transparency, accountability, and ethical conduct in blood donation programs, including donor screening, testing, and confidentiality practices?"
1440,"What strategies can universities employ to engage faculty members, staff, and administrators as active participants in blood donation initiatives and advocates for donation-related policies on campus?"
1441,How does blood donation improve health in the long term?
1442,What strategies can blood drive hosts employ to encourage first-time donors to participate?
1443,How can blood donation centers tailor appointment reminders to accommodate donors' busy schedules?
1444,How can blood donation centers leverage appointment reminder messages to promote awareness of specific blood products in high demand?
1445,What strategies can blood donation organizations use to address common misconceptions or fears about blood donation and alleviate donor anxieties?
1446,"How do blood donation organizations collaborate with international development agencies, humanitarian organizations, and global health initiatives to address blood supply challenges, strengthen transfusion services, and promote sustainable health systems in low- and middle-income countries?"
1447,"How do blood donation centers ensure the ethical collection, handling, and use of blood products, and what measures are in place to safeguard donor confidentiality, autonomy, and informed consent?"
1448,"How do cultural celebrations and religious holidays influence blood donation rates in Ethiopia, and can these events be leveraged to increase donations?"
1449,In what ways might donor demographics affect the availability of blood donors during times of scarcity?
1450,What role do peer-to-peer fundraising campaigns and community-driven initiatives play in mobilizing support for blood donation efforts and fundraising for related causes?
1451,How do blood donation organizations collaborate with schools and educational institutions to integrate blood donation education into curriculum standards or service-learning programs?
1452,What strategies can blood donation organizations employ to engage with donors who are unable to donate blood due to medical reasons or eligibility restrictions and provide alternative ways for them to contribute to donation efforts?
1453,How can blood banks assess the cost-effectiveness of automated blood collection?
1454,What strategies can be employed to improve donor communication and engagement regarding appointment scheduling?
1455,What impact does donor education and awareness campaigns have on donation rates?
1456,"What measures can be taken to prioritize the recruitment of donors from the senior population, recognizing their valuable contributions and potential as donors?"
1457,What are some potential drawbacks or challenges associated with overbooking appointments in blood donation centers?
1458,How do blood transfusion services in Africa ensure the equitable distribution of blood products among healthcare facilities?
1459,How can blood donation centers use appointment reminder messages to address common misconceptions or concerns about the donation process?
1460,How do blood donation centers address donor concerns about the confidentiality and privacy of personal health information collected during the donation process?
1461,"How do blood donation facilitation programs adapt their recruitment and outreach strategies to effectively engage younger generations, such as millennials and Gen Z, in donation efforts?"
1462,How do blood donation centers ensure the safety and quality of blood products through stringent testing and screening protocols?
1463,"How do blood transfusion services in Tanzania engage with traditional leaders, community elders, and opinion influencers to promote blood donation and support transfusion services?"
1464,How can health institutions support female health care professionals in becoming regular blood donors?
1465,How can donors stay informed about upcoming blood donation opportunities or events?
1466,How can appointment scheduling systems balance donor preferences for convenient appointment times with the need to maintain an adequate blood supply?
1467,"How do blood donation organizations collaborate with technology companies, software developers, and data scientists to innovate and develop digital solutions that enhance the efficiency, accessibility, and safety of blood donation processes?"
1468,What role does community outreach play in promoting awareness of blood donation facilitation programs and recruiting potential donors?
1469,"What measures can blood donation centers implement to address language barriers, cultural sensitivities, and health literacy issues among diverse donor populations, ensuring inclusivity and accessibility in donation services?"
1470,How can healthcare workers advocate for blood donation practices within their community?
1471,How does the lack of donor confidentiality and privacy protections impact donor willingness to participate in blood donation programs in Ethiopia?
1472,"What strategies can be employed to prioritize the recruitment of blood donors from younger generations, such as Generation Z, and engage them in donation activities?"
1473,What strategies can blood donation centers use to make appointment reminders more visually appealing and engaging?
1474,What role do partnerships play in advancing automated blood collection practices?
1475,How can blood donation centers leverage data analytics to optimize donor recruitment strategies and identify high-potential donor demographics?
1476,How can blood donation encourage a proactive approach to health?
1477,What role does donor education and empowerment play in promoting informed decision-making and enhancing donor satisfaction within an online blood donation management system?
1478,How do blood transfusion services address the cultural and religious considerations related to blood donation and transfusion in Africa?
1479,What strategies can blood donation facilitation programs employ to engage with younger generations and encourage them to become regular blood donors?
1480,How can universities collaborate with healthcare professionals and medical students to promote blood donation awareness and education in Ethiopia?
1481,What role do celebrity endorsements and partnerships play in raising awareness about blood donation and inspiring public participation?
1482,"What measures can be taken to promote donation among individuals with diverse gender identities and sexual orientations, and how can donation centers create inclusive and affirming environments for all donors?"
1483,How can blood donation facilitation programs collaborate with religious institutions and faith-based organizations to promote donation as an act of altruism and community service?
1484,What strategies can blood donation facilitation programs employ to encourage regular donors to recruit new donors and expand the donor base?
1485,How can blood donation support a healthier immune system?
1486,How can blood donation centers leverage social media and digital marketing to promote appointment scheduling and donation opportunities?
1487,"What are some of the recommendations proposed for improving voluntary blood donations in Tanzania, based on research findings?"
1488,What measures are in place to protect the rights and dignity of youth donors throughout the donation process?
1489,How can blood centers prioritize the recruitment of donors from sports and fitness communities?
1490,How might blood donation impact individuals' concentration and focus during daily tasks?
1491,"Can you discuss the impact of blood shortages on patient care and outcomes, particularly in the context of surgical procedures and emergency medical interventions?"
1492,What impact do educational workshops or seminars have on increasing donor participation?
1493,What strategies can blood donation centers use to encourage repeat donations and cultivate long-term donor relationships?
1494,What role do educational campaigns play in dispelling myths and misconceptions about blood donation?
1495,"Question 77 How can data analytics and digital health technologies be utilized to optimize blood donation campaigns, identify donor trends, and improve donor retention in Ethiopia?"
1496,"Can you discuss the potential role of incentives, such as tax breaks or health benefits, in motivating blood donation in Ethiopia?"
1497,What are the primary benefits of hosting blood drives for both donors and recipients?
1498,How can individuals benefit from consuming functional foods for successful blood donation?
1499,What impact do social and peer networks have on female health care professionals' willingness to donate blood?
1500,"Can you discuss the impact of cultural festivals, events, and ceremonies on blood donation rates and community engagement in Tanzania?"
1501,"What strategies can blood donation organizations use to engage with potential donors through mobile apps, gamification, and digital platforms that enhance the donation experience and encourage repeat donations?"
1502,What factors influence perceptions of blood donation in Africa?
1503,"What measures can blood donation centers implement to ensure the ethical recruitment and retention of donors, protect vulnerable populations, and uphold principles of voluntarism, autonomy, and informed consent?"
1504,How do blood donation centers collaborate with healthcare providers and hospitals to coordinate blood transfusions for patients?
1505,How can local media organizations support blood donation campaigns and outreach?
1506,"How do blood donation organizations collaborate with local businesses, retailers, and corporate sponsors to organize donation-themed events, offer donor incentives, and integrate blood donation into corporate social responsibility initiatives?"
1507,"What role do faith-based organizations, religious leaders, and spiritual communities play in promoting blood donation as a humanitarian act and addressing religious or cultural concerns related to donation practices?"
1508,How do blood donation centers engage with local communities to promote donation awareness?
1509,What strategies can universities employ to overcome logistical challenges in organizing blood donation drives on campus?
1510,"How do blood donation centers ensure the ethical recruitment and retention of vulnerable populations, such as homeless individuals or undocumented immigrants?"
1511,How do blood drive hosts adapt their strategies to address cultural or language barriers among potential donors?
1512,How do blood donation centers engage with local media outlets and journalists to raise awareness about donation needs and promote donation events and campaigns?
1513,"How do blood drive hosts collaborate with local chambers of commerce, business associations, or economic development agencies to promote blood donation as a corporate social responsibility (CSR) initiative, engage businesses in supporting donation efforts, and strengthen community partnerships?"
1514,What impact do international partnerships and collaborations have on addressing global blood supply challenges and supporting donation initiatives in low-resource settings?
1515,What measures are in place to educate potential blood donors about the donation process and eligibility criteria?
1516,"How do blood drive hosts collaborate with public libraries, community centers, or cultural institutions to host donation events, engage patrons, and promote literacy about blood donation and healthcare topics?"
1517,How do blood donation centers collaborate with law enforcement and emergency responders during mass casualty incidents or disasters?
1518,In what ways can blood donation centers utilize technology to improve the effectiveness of appointment reminders?
1519,"How do blood donation organizations collaborate with legal experts, ethicists, and human rights advocates to ensure that donation practices uphold principles of autonomy, confidentiality, and respect for donors' rights and dignity?"
1520,"What strategies can blood donation centers employ to address language and literacy barriers among donor populations with limited English proficiency or low health literacy, ensuring equitable access to donation information, resources, and services, and promoting informed decision-making and participation in donation activities?"
1521,What role does public education play in increasing awareness about blood donation and encouraging participation?
1522,How does the provision of comprehensive donor education and support contribute to prioritizing donor safety and satisfaction?
1523,How can blood donation centers leverage peer-to-peer fundraising campaigns and grassroots initiatives to mobilize support and raise awareness about donation?
1524,How do appointment scheduling systems address the logistical challenges of managing blood donation centers' physical infrastructure and resources?
1525,What impact do peer-to-peer fundraising campaigns have on increasing donor participation and engagement?
1526,How can technology be leveraged to improve the efficiency and effectiveness of blood donation appointment scheduling?
1527,What strategies can blood donation facilitation programs use to overcome stigma or misconceptions associated with blood donation and promote a positive image of donation within the community?
1528,"What strategies can blood donation organizations employ to engage with donors from different age groups, such as Baby Boomers, Generation X, and Generation Z, and tailor donation campaigns and messaging to resonate with each demographic?"
1529,How can blood banks promote diversity and inclusion in automated blood collection practices?
1530,How can blood donation centers address language barriers in appointment reminders for donors with diverse linguistic backgrounds?
1531,How does the program engage with schools and educational institutions to promote blood donation among youth?
1532,What measures are implemented to address donor deferral challenges and minimize the impact on blood supply availability?
1533,What strategies can blood donation centers use to attract and retain donors from younger demographic groups?
1534,What innovative strategies and technologies can be employed to recruit and engage blood donors from traditionally underrepresented or marginalized communities in Ethiopia?
1535,What are the potential advantages of using automated blood collection for special blood drives or campaigns?
1536,What role can religious leaders and community elders play in promoting voluntary blood donation and dispelling myths in Tanzania?
1537,What measures can blood donation centers take to ensure that appointment reminders are delivered securely and protect donors' privacy?
1538,Can appointment reminder messages be integrated with existing healthcare or wellness apps to reach donors more effectively?
1539,How can blood donation benefit individuals with chronic pain?
1540,What role do donor feedback and satisfaction surveys play in improving the effectiveness of blood donation facilitation programs?
1541,"What measures can blood donation centers take to address disparities in blood donation rates among different demographic groups, such as racial or ethnic minorities?"
1542,"What measures can blood donation facilitation programs take to ensure the safety and integrity of donated blood during collection, processing, and distribution?"
1543,"How do public education campaigns and health literacy initiatives contribute to raising awareness about blood donation, dispelling myths, and empowering individuals to make informed decisions about donation participation?"
1544,Can you discuss the role of international collaborations and partnerships in supporting blood transfusion services in resource-limited settings?
1545,What factors were monitored during feline blood donation?
1546,How can individuals benefit from increasing their intake of healthy fats for donation?
1547,How can appointment reminders be tailored to accommodate donors with special needs or accessibility requirements?
1548,"What strategies can be employed to encourage whole blood donation, as opposed to specific blood components, to meet the diverse needs of patients and maintain adequate supply levels?"
1549,What impact does workplace culture have on female health care professionals' blood donation practices?
1550,How do cultural taboos or stigmas surrounding blood and donation impact donation rates within certain communities?
1551,What strategies can be implemented to overcome logistical challenges in distributing blood products to remote or underserved areas?
1552,What steps are taken to address potential barriers related to transportation or mobility for youth donors?
1553,What role do professional associations and societies play in setting standards and guidelines for blood donation practices?
1554,How can donating blood support those with traumatic injuries?
1555,How do blood donation facilitation programs collaborate with healthcare providers and medical professionals to promote blood donation and ensure donor eligibility?
1556,How does public trust in healthcare systems and blood transfusion services impact donation rates and the availability of blood products in Tanzania?
1557,How do appointment scheduling strategies contribute to donor retention and long-term engagement with blood donation programs?
1558,How can appointment reminders be adapted to accommodate donors with different communication preferences?
1559,How can blood donation facilitation programs collaborate with businesses and corporations to organize donation events and engage employees in donation efforts?
1560,How do perceptions of blood donation as a form of social responsibility influence donation behavior among younger generations?
1561,How does the perception of donation as a social norm influence donation behavior?
1562,What role does hydration play in successful blood donation?
1563,What strategies can blood donation organizations employ to reach underserved or marginalized communities and increase blood donation among these populations?
1564,"What strategies can blood donation centers implement to target specific demographic groups, such as young adults, minorities, or rural communities, and increase donation participation within these populations?"
1565,How do blood donation centers collaborate with public health agencies and emergency responders during times of crisis or disaster?
1566,What are the key considerations for blood donation centers when selecting and implementing donor management software systems?
1567,What role can community partnerships play in supporting appointment scheduling initiatives for blood donation centers?
1568,"How do innovations in blood collection techniques and donation technology impact donor experience, donation efficiency, and blood product quality?"
1569,"What strategies can blood drive hosts employ to engage with potential donors through online gaming communities, esports events, or virtual reality platforms, leveraging digital technologies and gaming culture to promote blood donation as a positive social activity and encourage participation among tech-savvy audiences?"
1570,How can technology be utilized to streamline blood donation campaigns and processes?
1571,"What evidence-based strategies can be implemented to prioritize blood donor perceptions, motivators, and deterrents in Tanzania?"
1572,"What role do mobile blood donation units play in expanding access to donation opportunities, particularly in rural or remote areas, and how do blood donation organizations coordinate mobile drives to reach underserved populations?"
1573,What role do social media influencers and online personalities play in raising awareness about blood donation and encouraging participation among their followers?
1574,How might whole blood donation affect individuals' concentration during work or school?
1575,"How do appointment scheduling systems handle donor preferences for specific donation types, such as whole blood or platelet donations?"
1576,"Are there any privacy concerns associated with sending appointment reminder messages to blood donors, and how can they be addressed?"
1577,What measures can blood donation centers take to minimize the impact of appointment cancellations and no-shows?
1578,What impact do workplace blood donation programs have on increasing donor participation and fostering a culture of corporate social responsibility?
1579,How can blood donation support public health initiatives?
1580,What strategies can health institutions employ to encourage female health care professionals to advocate for blood donation among their peers?
1581,"How do blood transfusion services in Tanzania adapt to seasonal variations in blood demand, such as during holidays or festive periods?"
1582,"How do appointment scheduling systems manage donor preferences for specific donation types, such as whole blood or platelet donations?"
1583,What strategies are employed to encourage regular blood donation among existing donors and foster a culture of giving?
1584,What strategies can blood donation centers implement to maintain donor engagement and participation in the face of donor fatigue during prolonged crises like the COVID-19 pandemic?
1585,What measures can be implemented to address the psychological impact of blood shortages on healthcare providers and patients?
1586,"How do blood donation programs cater to the distinctive requirements and anxieties of pediatric donors, encompassing infants, children, and adolescents, and ensure their safety, ease, and welfare during donation procedures?"
1587,How can blood donation contribute to weight management?
1588,What measures are taken by blood donation facilitation programs to address donor concerns about pain or discomfort during the donation process?
1589,What are some of the key challenges faced by transfusion services in sub-Saharan Africa in meeting the demand for blood transfusions?
1590,How can blood donation foster a sense of civic duty?
1591,How does the perception of donation as a routine healthcare practice influence donation behavior?
1592,What strategies can blood banks use to optimize inventory management in automated blood collection?
1593,"What role do legislative advocacy and policy reform efforts play in addressing systemic barriers to blood donation, such as discriminatory eligibility criteria, and promoting equitable access to donation opportunities for all eligible individuals?"
1594,"Can you discuss the impact of cultural ceremonies, traditions, and taboos on blood donation rates and practices in Tanzania?"
1595,How does community involvement impact the success of blood drives?
1596,"How do blood donation organizations collaborate with local community centers, religious institutions, and cultural organizations to address language barriers, cultural sensitivities, and other factors that may affect participation in blood donation events among immigrant and refugee populations?"
1597,What medical evaluations are performed on donors before blood donation?
1598,How can individuals benefit from increasing their intake of soluble fiber for donation?
1599,What role can art and creative expression play in raising awareness about blood donation and inspiring participation among diverse communities in Ethiopia?
1600,What measures can blood donation organizations take to ensure the equitable distribution of blood products and address disparities in access to transfusion services?
1601,"Question 87 How does the lack of public awareness about blood donation processes and the importance of regular donation contribute to donor shortages in Ethiopia, and what strategies can be employed to address this?"
