query_id,query
0,How can blood donation centers collaborate with local healthcare providers and hospitals to optimize blood utilization practices and minimize unnecessary transfusions?
1,What strategies can be employed to address the stigma and discrimination often associated with blood donation in certain communities in Tanzania?
2,What role do community events or festivals play in promoting blood donation and attracting potential donors?
3,How can blood donation centers collaborate with transportation and logistics companies to optimize supply chain management and ensure timely delivery of blood products to healthcare facilities and patients in need?
4,How do blood donation centers ensure the quality and safety of donated blood?
5,How can health organizations leverage female health care professionals' influence in blood donation initiatives?
6,"How do blood donation organizations collaborate with government agencies and public health authorities to ensure compliance with regulatory standards and guidelines for blood collection, processing, and distribution?"
7,What factors influence an individual's decision to donate blood?
8,What role can corporate partnerships and sponsorships play in supporting blood donation facilitation programs?
9,What role can peer-to-peer outreach programs and youth-led initiatives play in promoting blood donation among young people in Tanzania?
10,What role do regulatory agencies and accreditation bodies play in overseeing compliance with national guidelines for STI screening of donated blood?
11,How can individuals benefit from increasing their intake of iron-fortified foods for donation?
12,What are some of the challenges faced in pre-transfusion testing in Uganda?
13,What strategies can blood donation organizations employ to engage with multicultural communities and address language barriers to ensure that all potential donors have access to donation information and services?
14,How does ABC help optimize blood donation campaigns?
15,What were the primary objectives of utilizing blood transfusions in treating Ebola hemorrhagic fever?
16,"How do blood donation programs address the needs and preferences of diverse donor populations, including minority communities, individuals with disabilities, and those with religious or cultural sensitivities?"
17,"What role can alumni networks play in supporting ongoing blood donation initiatives at universities, even after students graduate?"
18,"What role can volunteer blood donor advocates and peer educators play in raising awareness, dispelling myths, and encouraging regular blood donation within their social circles and communities?"
19,"How can blood donation centers collaborate with religious leaders and faith-based organizations to incorporate donation advocacy into religious teachings, rituals, and community service initiatives, and how can donation centers respect and accommodate diverse religious beliefs and practices?"
20,What measures can blood donation centers take to enhance the accessibility of donation services for individuals with limited mobility or transportation options?
21,"How can blood donation centers leverage storytelling and patient testimonials to humanize donation experiences, inspire empathy, and encourage community support for blood donation initiatives?"
22,How can healthcare professionals promote blood donation awareness in their practice?
23,How do blood donation centers collaborate with international organizations to address global blood supply challenges?
24,How can donating blood encourage a culture of giving?
25,How do blood drive hosts address concerns related to blood shortages and fluctuating demand for blood products?
26,How can individuals benefit from increasing their intake of healthy fats for blood donation?
27,How do blood donation centers address concerns about the safety and efficacy of blood products among donors who may be hesitant to donate?
28,What initiatives can blood donation centers implement to encourage first-time donors to become regular donors?
29,How does the program address potential barriers related to parental or community opposition to youth blood donation?
30,How can blood donation facilitation programs utilize social media platforms to expand their reach and engage with potential donors?
31,How do blood donation centers address donor concerns and inquiries about the donation process?
32,What strategies can blood donation centers use to engage with potential donors through online platforms and social media channels?
33,What role do schools and educational institutions play in promoting blood donation awareness among students and young adults?
34,"How can blood donation facilitation programs engage with donor families and recipients to foster connections and gratitude, promote donor recognition, and encourage continued support for donation initiatives?"
35,How can individuals benefit from avoiding sugary snacks before donation?
36,What strategies can blood donation facilitation programs employ to engage with potential donors through social media and online platforms?
37,"What are the long-term efficiency and safety implications of increasing the frequency of blood donation appointments, and how do reminder interventions contribute to these outcomes?"
38,How can ABC help blood banks meet the demands of patients with rare blood types?
39,What role can peer-to-peer outreach and recruitment play in expanding the donor base and promoting a culture of donation within social networks?
40,How do blood donation programs engage with faith-based organizations and religious communities to promote donation awareness and participation?
41,"How do blood donation organizations collaborate with schools, colleges, and universities to engage students, faculty, and staff in educational programs, volunteer opportunities, and donation events that promote the importance of blood donation and civic engagement?"
42,How do blood centers monitor and evaluate the effectiveness of their screening programs?
43,How can automated blood collection enhance the availability of specialized blood products?
44,What are the common side effects or reactions that donors may experience during or after blood donation?
45,How do blood donation facilitation programs support donors' physical and emotional well-being throughout the donation process?
46,What role can peer-to-peer messaging or donor testimonials play in encouraging appointment attendance?
47,How can individuals benefit from consuming more nuts and seeds for successful blood donation?
48,"How do blood donation centers collaborate with blood research institutions, academic centers, and medical laboratories to advance scientific knowledge, develop innovative technologies, and improve transfusion medicine practices?"
49,How do blood donation centers engage with donor advocacy groups and patient organizations to address specific needs and concerns related to blood transfusion?
50,How do blood donation centers adapt their recruitment and collection strategies to address seasonal fluctuations and changes in donation patterns?
51,Can you explain the role of hemovigilance systems in monitoring and improving the safety of blood transfusion services in Africa?
52,"How do national guidelines address the coordination and collaboration between blood collection facilities, public health agencies, and other stakeholders in STI screening efforts?"
53,How does the prevalence of transfusion-transmissible infections impact blood safety and donor eligibility criteria in Tanzania?
54,What role do school-based education programs or curriculum initiatives play in educating students about the science and importance of blood donation?
55,"What role can youth-led social movements and activism play in mobilizing peers, raising awareness, and advocating for policy reforms to strengthen blood donation systems and address healthcare inequalities?"
56,How do blood transfusion services in Africa collaborate with national and international organizations to address common challenges and share best practices?
57,"What are the key considerations for implementing effective blood donation campaigns in multicultural communities, and how can programs ensure cultural sensitivity and inclusivity?"
58,What measures can blood donation facilitation programs take to ensure the equitable distribution of resources and services among different geographic regions?
59,How can blood banks promote transparency and accountability in automated blood collection?
60,What steps are taken to ensure the safety and integrity of blood samples collected for STI screening?
61,What measures are in place to ensure the timely and effective implementation of STI screening programs in blood collection facilities?
62,"What strategies can blood donation organizations use to engage with potential donors in rural or remote areas, where access to donation centers may be limited, and transportation challenges may exist?"
63,How does the apheresis process work in automated blood collection?
64,"What logistical challenges do blood donation organizations face in coordinating mobile blood drives, and how are these challenges addressed to ensure the success of donation events?"
65,How does donating blood promote greater empathy?
66,"How can schools and educational institutions integrate blood donation education into their curriculum, promote donation awareness among students and faculty, and cultivate a culture of giving and community service from a young age?"
67,How do mobile blood donation units and community-based outreach programs contribute to increasing donor participation and reaching underserved populations?
68,What measures can blood centers take to address disparities in access to online blood donation management systems among underserved or marginalized communities?
69,How do blood donation facilitation programs address the needs of first-time donors and ensure a positive experience that encourages future participation?
70,"How do blood donation organizations leverage social media platforms, online influencers, and digital marketing campaigns to raise awareness about blood donation, engage with younger audiences, and inspire action?"
71,"What are some of the cultural factors and beliefs that influence attitudes towards blood donation in Tanzania, and how can they be addressed?"
72,How does the blood donation center manage worries regarding the effects of donation on donors' health and overall condition?
73,How can individuals benefit from increasing their intake of vitamin B12 for donation?
74,What methods can health organizations use to increase female health care professionals' participation in blood donation?
75,How do blood donation centers in Tanzania ensure the confidentiality and privacy of donor information?
76,"What impact do blood donor recognition programs, appreciation events, or donor loyalty rewards have on fostering donor retention, building a sense of belonging, and cultivating a dedicated community of blood donors committed to saving lives through regular donation?"
77,What measures are in place to prevent the transmission of blood-borne diseases through donated blood?
78,How can health organizations use female health care professionals as role models to encourage blood donation?
79,"How can hosts of blood drives utilize strategies to interact with potential donors amid public health crises or emergency scenarios, like pandemics or natural disasters?"
80,How might whole blood donation affect concentration and cognitive function during daily tasks?
81,What are the procedures for confirming reactive screening results for STIs in donated blood?
82,"What strategies can blood donation organizations employ to engage with underserved communities, including rural areas, low-income neighborhoods, and immigrant populations, to ensure equitable access to blood donation services?"
83,"How do blood donation centers collaborate with emergency response agencies, disaster relief organizations, and humanitarian aid groups to ensure timely access to blood products during crises, emergencies, and natural disasters?"
84,How can donating blood promote healthy weight management?
85,How does NHSBT respond to incidents with multiple casualties in terms of blood product provision?
86,What role do government agencies play in promoting blood donation awareness and practices?
87,How can partnerships with local media promote blood donation awareness?
88,What strategies can blood donation centers use to encourage regular donation among existing donors?
89,"What strategies are employed to recruit and retain blood donors, particularly among underrepresented or minority communities?"
90,What measures can blood donation centers take to accommodate donors with special needs or accessibility requirements in the appointment scheduling process?
91,How can appointment reminders be tailored to address specific donor concerns or preferences?
92,What role does trust in healthcare institutions play in blood donation behavior?
93,What role do corporate partnerships and workplace blood donation programs play in promoting donation participation among employees?
94,"How can mobile health (mHealth) technologies be leveraged to facilitate blood donation, donor recruitment, and appointment scheduling?"
95,How can blood centers prioritize the recruitment of donors from underrepresented ethnic and racial groups?
96,"What role can blood donation centers play in supporting disaster preparedness and response efforts within their communities, and how can donation centers collaborate with emergency response organizations to ensure timely access to blood products during crises?"
97,What strategies can blood donation facilitation programs employ to engage and retain first-time donors?
98,How can blood donation practices be made more inclusive and accessible to all members of the community?
99,What role do professional associations and societies play in providing guidance and support to blood donation centers?
100,What strategies can be employed to engage younger generations in blood donation initiatives and cultivate a culture of lifelong donation?
101,"How can social media platforms and online influencers be leveraged to raise awareness about blood donation, reach younger demographics, and inspire donation participation through engaging content and storytelling?"
102,How can governments incentivize private sector involvement in blood donation initiatives while ensuring the integrity and safety of the donation process?
103,"How are the distinctive requirements and apprehensions of pediatric donors, encompassing infants, children, and adolescents, addressed by blood donation programs to ensure their safety, comfort, and welfare during donation procedures?"
104,How can donating blood impact individuals with migraine?
105,"How do social determinants of health, such as income inequality, housing instability, and food insecurity, impact donation participation and donor demographics, and what strategies are employed to address these disparities?"
106,How can universities collaborate with international NGOs and humanitarian organizations to address systemic challenges and strengthen blood donation systems in Ethiopia?
107,"How can public-private partnerships facilitate investment in blood donation infrastructure, technology, and research to address long-term challenges and opportunities in the field?"
108,What strategies are employed to ensure the sustainability and scalability of youth-focused blood donation programs?
109,How can donor centers prioritize recruitment efforts among older adults and retirees to maintain a stable and reliable donor base?
110,How do blood donation centers engage with faith-based organizations and religious communities to promote blood donation as an act of service and altruism?
111,How do blood donation centers address donor concerns regarding the safety and efficacy of donated blood products?
112,How do blood donation centers address misconceptions and myths about blood donation through education and outreach efforts?
113,How do blood donation facilitation programs ensure the privacy and security of donor information?
114,How do blood donation centers in Tanzania address the cultural and religious beliefs that may impact willingness to donate blood?
115,What role do donor incentives play in encouraging timely attendance to blood donation appointments?
116,"What strategies can blood donation centers implement to recruit and retain a diverse pool of volunteer blood drive organizers, ambassadors, and advocates, reflecting the cultural, linguistic, and demographic diversity of their donor base and target communities?"
117,"How do blood donation programs address the specific needs and concerns of pediatric donors, including infants, children, and adolescents, and ensure their safety, comfort, and well-being during donation procedures?"
118,"How can blood donation centers utilize gamification techniques to enhance donor engagement, incentivize participation, and cultivate a sense of community among donors?"
119,How do appointment reminders contribute to maintaining a consistent donor base for blood donation centers?
120,How can blood donation facilitation programs collaborate with community health centers and clinics to reach underserved populations and promote donation?
121,What strategies can blood donation centers use to follow up with donors who have missed their appointment despite receiving reminders?
122,What strategies can blood donation facilitation programs use to engage with potential donors who may be hesitant or reluctant to donate due to fear or uncertainty?
123,"How do blood donation organizations engage with legislative bodies and policymakers to advocate for policies that support blood donation and transfusion medicine practices, and how do they influence legislative decision-making processes?"
124,How can individuals maintain healthy blood pressure for successful blood donation?
125,"How do blood donation facilitation programs address concerns about the safety and efficacy of donation practices, particularly during public health emergencies?"
126,How can individuals benefit from increasing their intake of omega-3 fatty acids for donation?
127,What measures are in place to protect the privacy and confidentiality of donor information?
128,How do blood donation centers address donor concerns about the potential for needlestick injuries or transmission of infectious diseases during the donation process?
129,"What role can blood donation centers play in supporting global health initiatives, humanitarian aid efforts, and disaster response operations, contributing expertise, resources, and lifesaving blood products to address critical health needs and emergencies in low-resource settings or conflict-affected areas?"
130,How can individuals benefit from consuming more dairy products for donation?
131,How do blood drive hosts collaborate with transportation companies or logistics providers to ensure the timely delivery of blood products to healthcare facilities and patients awaiting transfusions?
132,What role do peer-to-peer fundraising campaigns play in prioritizing donor recruitment and engagement?
133,What measures can blood donation centers take to ensure the safety and well-being of donors during the donation process?
134,How can data analytics and predictive modeling be utilized to optimize blood donation management systems and anticipate future supply and demand patterns?
135,What are some examples of transfusion-transmissible infections that donated blood is screened for?
136,"How do blood donation organizations address challenges related to donor retention, such as donor fatigue or attrition, and implement strategies to maintain long-term donor engagement?"
137,Can you discuss the role of community health workers in promoting blood donation awareness and facilitating donation drives in Tanzania?
138,What effects do personal health and lifestyle have on female health care professionals' ability to donate blood?
139,What is the timing of withdrawal for individuals with temporary medical indications according to the approved guidelines?
140,What strategies can be employed to enhance public trust and confidence in blood transfusion services during the pandemic?
141,"Can individuals who have received certain medical treatments, such as chemotherapy or radiation therapy, donate blood, and if so, are there any waiting periods or restrictions?"
142,What is the focus of bottom-up planning processes in calibrating blood stock levels during heightened demand?
143,How can blood donation facilitation programs adapt to accommodate the unique needs or preferences of different donor demographics?
144,How can blood donation programs be tailored to address specific cultural concerns in Africa?
145,"How are permanent medical contraindications determined and documented for individuals seeking to donate blood, according to the approved guidelines?"
146,How do perceptions of donation as a means of expressing gratitude or reciprocity influence donation behavior?
147,How does blood donation promote greater cultural understanding?
148,How can automated blood collection contribute to a more efficient blood supply?
149,How do blood donation centers address donor concerns about the potential psychological impact or emotional stress of donating blood?
150,"How can regulatory frameworks and quality assurance mechanisms ensure the safety, efficacy, and traceability of blood products throughout the supply chain in Ethiopia?"
151,How can blood donation benefit individuals with iron overload?
152,How can health leaders advocate for blood donation among female health care professionals?
153,"Question 78 What measures can be taken to ensure the equitable distribution of blood and blood products across different regions of Ethiopia, particularly during emergencies or outbreaks?"
154,What strategic communication management frameworks can be employed to prioritize non-donors and enhance blood donor recruitment efforts?
155,Question 79 How does the cultural practice of blood sharing or communal blood pools influence perceptions of blood donation and the acceptability of transfusion services in Ethiopia?
156,"What role can youth-led organizations, student clubs, and volunteer networks play in driving blood donation advocacy, education, and engagement initiatives among their peers and communities?"
157,What strategies can blood donation facilitation programs use to engage with donors who have lapsed or discontinued donation participation and encourage them to re-engage with donation initiatives?
158,What are the potential risks associated with overbooking blood donation appointments?
159,What challenges might blood banks face when implementing automated blood collection?
160,"What role do donor recruitment and retention programs play in maintaining a stable and sufficient blood supply, and how do blood donation organizations measure the effectiveness of these programs?"
161,What role do technology and innovation play in improving the efficiency and effectiveness of blood donation processes and services?
162,How does the implementation of donor incentives or rewards programs impact blood donation rates and donor retention?
163,How do donor deferral policies and eligibility criteria impact the inclusivity and diversity of blood donors in Africa?
164,What is the current reliance status on emergency blood donations for immediate blood product provision after major incidents?
165,How can partnerships with faith-based organizations promote blood donation awareness?
166,How do blood donation centers in Tanzania utilize technology and digital platforms to streamline the donation process and enhance donor engagement?
167,"How can blood donation centers use storytelling and impact narratives to inspire donors, recognize their contributions, and build a sense of community around blood donation?"
168,How do blood donation centers adapt their operations and protocols during public health emergencies or crises?
169,How can behavioral insights be integrated into the design of blood donation appointment reminder systems?
170,What role does workplace environment play in influencing female health care professionals' propensity to donate blood?
171,How do blood centers manage the storage and transport of blood samples for screening purposes?
172,What measures can blood donation centers take to enhance donor satisfaction and improve the overall donor experience?
173,"Question 44 What impact does donor education and empowerment have on donor recruitment, retention, and satisfaction?"
174,"What strategies can be employed to encourage repeat donation among individuals who have previously donated blood, platelets, or plasma, and how can donation centers recognize and reward donor loyalty to foster continued engagement and support?"
175,What role do professional associations or industry groups play in supporting blood donation initiatives within their sectors?
176,"How can community health workers, traditional birth attendants, and frontline healthcare providers be trained and equipped to promote blood donation, screen potential donors, and provide education about safe donation practices in Ethiopia?"
177,What strategies can blood centers employ to prioritize the recruitment of donors who are willing to participate in community-based donation events?
178,How can blood donation centers collaborate with local food banks and social service agencies to address food insecurity and promote donation as a way to give back to the community?
179,What measures can blood donation centers implement to ensure equitable distribution of appointment slots among donors from different geographic regions?
180,How do blood donation centers ensure the safety and quality of blood products through rigorous testing and screening procedures?
