query_id,query
1951,"What impact do community-based blood donor recruitment drives or mobile donation units have on increasing access to donation opportunities, diversifying the donor pool, and addressing disparities in blood supply within underserved or marginalized populations?"
1952,"What strategies can be employed to address vaccine hesitancy and misinformation related to blood donation, particularly in the context of concerns about vaccine safety and efficacy?"
1953,How can blood donation campaigns increase participation among younger populations in Africa?
1954,What role does real-time data analytics play in monitoring and optimizing appointment scheduling efficiency for blood donation centers?
1955,How do blood drive hosts utilize storytelling or personal testimonies to connect with potential donors?
1956,How do blood donation organizations collaborate with public health agencies and community health centers to promote blood donation as a preventive health measure and integrate donation opportunities into routine healthcare services and wellness programs?
1957,"What role can educational campaigns and public awareness initiatives play in debunking myths and misconceptions about blood donation and transfusion safety, particularly in regions with low donation rates or high prevalence of misinformation?"
1958,"How do donor registries and digital platforms for donation management contribute to streamlining donor recruitment, facilitating communication, and ensuring traceability and accountability in blood donation programs?"
1959,What measures can blood donation centers take to ensure the equitable representation of diverse demographic groups in donor recruitment efforts?
1960,How often can individuals donate plasma and blood?
1961,How can blood donation inspire advocacy for public health policy?
1962,What measures can blood donation centers take to address donor concerns about potential side effects or adverse reactions to blood donation?
1963,How can blood centers prioritize the recruitment of donors who are willing to participate in community outreach and advocacy efforts?
1964,What role do mobile blood donation units play in reaching rural or remote areas and ensuring access to blood donation services for underserved populations?
1965,"What strategies can blood donation organizations employ to engage with donors who may be hesitant or uncertain about donating blood, particularly during times of crisis or public health emergencies, and provide reassurance and support to encourage their participation?"
1966,How do national guidelines address the provision of post-donation care and support for donors undergoing STI screening?
1967,How can blood donation promote hope for patients?
1968,How can a person benefit from consuming more of tofu and soy products before donation?
1969,What role does donor education and counseling play in promoting repeat donations and maintaining a committed donor base?
1970,How do blood drive hosts engage faith-based organizations or religious communities in supporting donation efforts?
1971,"How do automated tools for donor recruitment and engagement, such as online donor portals or mobile applications, improve the donor experience, simplify communication, and support donor retention within blood donation programs?"
1972,What is the role of anesthesia in feline blood donation?
1973,How can blood donation centers effectively utilize email as a channel for appointment reminders to maximize donor engagement and attendance?
1974,How do blood donation centers manage the ethical considerations surrounding the collection and use of umbilical cord blood for therapeutic purposes?
1975,What role does donor communication and engagement play in building trust and fostering long-term relationships through an online blood donation management system?
1976,"How do blood donation organizations collaborate with schools, colleges, and universities to engage students, faculty, and staff in blood donation initiatives, integrate donation opportunities into campus events and activities, and foster a culture of giving and community service on campus?"
1977,What strategies are recommended in national guidelines for promoting voluntary blood donation and increasing donor participation in STI screening programs?
1978,How do blood donation facilitation programs address concerns about confidentiality and privacy for donors?
1979,"What role can targeted advertising and outreach play in reaching specific demographic groups, such as first-time donors, minority communities, or older adults, and increasing their participation in blood donation?"
1980,How does the management of blood supplies during an influenza pandemic involve prioritization?
1981,Question 13 What strategies can be employed to address language and literacy barriers among potential blood donors?
1982,What role can traditional healers and community health workers play in promoting blood donation as a preventive health measure in Ethiopia?
1983,"How can appointment reminders be tailored to address specific donor concerns or hesitations, such as fear of needles or donation anxiety?"
1984,How does donor anonymity influence donation motivations and behaviors?
1985,What role can traditional healers and community leaders play in endorsing and promoting blood donation in Africa?
1986,What role can community influencers or advocates play in amplifying the reach of appointment reminder messages for blood donation centers?
1987,"What strategies can blood donation organizations use to recruit and retain donors from diverse cultural backgrounds, ethnicities, and communities, ensuring that the blood supply reflects the diversity of the population it serves?"
1988,"How do donor registries and digital platforms used for donation management aid in simplifying donor recruitment processes, fostering communication, and ensuring transparency and responsibility within blood donation programs?"
1989,What role can educational initiatives play in prioritizing blood donation among young adults and fostering a culture of lifelong donor engagement?
1990,How can blood donation facilitation programs leverage philanthropic partnerships and fundraising efforts to secure resources and support for donation initiatives?
1991,How can blood banks address potential risks associated with automated blood collection?
1992,"Question 91 How do cultural practices and beliefs influence attitudes towards blood donation in different regions of Ethiopia, and how can donation programs accommodate cultural diversity?"
1993,"How do blood donation organizations collaborate with mental health professionals and support organizations to address concerns about needle phobia, anxiety, or other psychological barriers to blood donation and provide support services to donors with mental health needs?"
1994,What strategies are employed to overcome barriers related to fear or anxiety about the donation process among youth?
1995,"How do blood donation organizations collaborate with educational institutions, youth organizations, and student groups to promote blood donation as a community service activity, engage young donors, and foster a culture of giving back among students?"
1996,How do blood donation centers collaborate with academic research institutions and scientific communities to advance knowledge and innovation in transfusion medicine?
1997,"What strategies can blood donation organizations employ to engage with donors from diverse linguistic backgrounds, ensure language access, and provide culturally sensitive support and information throughout the donation process?"
1998,"How does blood donation contribute to strengthening health systems and building resilience to health emergencies, natural disasters, and other crises?"
1999,What are some potential benefits of implementing electronic health records (EHRs) in blood donation centers?
2000,What are some potential challenges or barriers to blood donation participation among minority or marginalized populations?
2001,What role do corporate partnerships and workplace blood donation programs play in facilitating blood donation and encouraging employee participation?
2002,How do blood donation organizations collaborate with faith-based groups and religious institutions to promote blood donation as an act of compassion and service within religious communities?
2003,How can blood donation impact individuals with genetic disorders?
2004,"How do blood donation centers collaborate with transportation services and logistics companies to optimize the collection, storage, and distribution of blood products across different geographic regions?"
2005,What role do educational campaigns and public awareness initiatives play in promoting blood donation?
2006,"Can you discuss the potential role of digital health technologies, such as electronic health records and telemedicine, in improving blood donation practices and transfusion outcomes in Ethiopia?"
2007,"What initiatives can blood donation centers undertake to encourage community members to become blood donation advocates, volunteers, or peer recruiters, actively participating in donor recruitment and retention efforts?"
2008,How can blood banks promote the benefits of automated blood collection to the public?
2009,How can blood donation facilitation programs leverage social media and digital marketing to reach a wider audience and engage potential donors?
2010,What are some potential barriers to implementing mobile blood donation units in rural or underserved areas?
2011,How can blood donation centers ensure that appointment reminder messages are accessible and inclusive for donors with disabilities or language barriers?
2012,How do blood drives contribute to raising awareness about the importance of blood donation?
2013,"What role can regulatory agencies, accreditation bodies, and quality assurance programs play in ensuring the safety, efficacy, and quality of blood transfusion services and products, while also promoting continuous improvement and compliance with established standards and guidelines?"
2014,How do blood donation centers ensure the safety and quality of blood products during the processing and storage phases?
2015,"How can blood donation centers collaborate with sports organizations and athletic teams to promote donation as a healthy and altruistic practice that complements physical fitness and wellness lifestyles, and how can donation centers leverage sports partnerships and events to engage athletes and fans in donation activities?"
2016,What are the advantages of using apheresis machines in blood donation?
2017,How do public-private partnerships contribute to innovation and capacity-building in blood transfusion services in Tanzania?
2018,How can donating blood promote community engagement?
2019,How can blood donation centers utilize data analytics to optimize the timing and content of appointment reminders?
2020,"How can technology and digital platforms be leveraged to streamline blood donation processes, improve donor engagement and retention, and enhance the efficiency and effectiveness of donation programs?"
2021,How do blood donation centers ensure the safety and efficacy of blood products derived from apheresis procedures?
2022,What strategies can blood donation organizations implement to address language barriers and enhance inclusivity in donation campaigns?
2023,"How can social marketing techniques, behavioral nudges, and peer influence strategies be leveraged to motivate behavior change, normalize blood donation as a social norm, and sustain participation in Ethiopia?"
2024,How do perceptions of blood donation as a way to honor loved ones or commemorate special occasions influence donation behavior?
2025,What role does media coverage of blood shortages or emergencies play in motivating blood donation?
2026,How do blood donation organizations collaborate with international partners and humanitarian organizations to support global efforts to increase access to safe blood products and transfusion services?
2027,"What strategies are employed to ensure equitable access to blood donation services and transfusion care for all individuals, regardless of socioeconomic status or geographic location?"
2028,How can individuals benefit from consuming more fiber-rich foods before blood donation?
2029,What are the permanent medical contraindications for donating blood as listed in the approved guidelines?
2030,How are adverse events or reactions during or after the donation process managed and reported according to the approved guidelines?
2031,What measures can be implemented to ensure the ethical recruitment of blood donors and protect vulnerable populations from coercion or exploitation?
2032,How do appointment scheduling systems handle the coordination of group donations or corporate blood drives?
2033,How do religious holidays or observances impact blood donation rates among religious communities?
2034,How do donor recognition programs or rewards affect donor retention rates?
2035,How can blood donation facilitation programs address cultural or language barriers to ensure inclusivity and accessibility for all potential donors?
2036,How can individuals benefit from reducing their intake of refined carbohydrates before donation?
2037,How do blood transfusion services collaborate with infectious disease experts and epidemiologists to monitor and respond to emerging pathogens and infectious disease outbreaks?
2038,"What innovative technologies, such as drones or refrigerated delivery systems, can be utilized to enhance the transportation and storage of blood products in resource-limited settings?"
2039,"What types of blood products can donors contribute to, besides whole blood donation?"
2040,How can automated blood collection contribute to the development of advanced transfusion therapies?
2041,How can individuals benefit from consuming more salmon for donation?
2042,How can blood donation facilitation programs utilize data analytics and technology to improve operational efficiency and donor engagement?
2043,What role does donor advocacy play in prioritizing policy changes and legislative efforts to support blood donation programs?
2044,"How can blood donation centers collaborate with educational institutions, schools, and youth organizations to promote donation awareness, engage young donors, and cultivate a culture of giving and community service among students?"
2045,How do surgery and trauma contribute to the demand for blood transfusions in sub-Saharan Africa?
2046,What role do digital platforms and online communities play in facilitating blood donation awareness and engagement among tech-savvy donors?
2047,"How can blood donation facilitation programs adapt their strategies to address the needs of marginalized and vulnerable populations, including homeless individuals, immigrants, and refugees?"
2048,How can individuals benefit from avoiding caffeine before a blood donation?
2049,"What strategies can be employed to prioritize donation among individuals with diverse gender identities and sexual orientations, and how can donation centers create inclusive and affirming spaces for all donors?"
2050,Can you explain the concept of fractionation in blood processing and its significance in maximizing the utility of donated blood?
2051,How does the lack of standardized training and certification for phlebotomists and blood transfusion professionals affect the quality of blood transfusion services in Tanzania?
2052,What role does donor feedback play in driving continuous improvement and innovation in appointment scheduling systems for blood donation centers?
2053,What measures can blood donation centers take to address donor concerns about the potential side effects or adverse reactions to donation?
2054,What strategies can blood donation centers employ to engage donors and encourage them to refer friends or family members to schedule appointments?
2055,"How do blood drive hosts collaborate with local government agencies, emergency responders, or disaster preparedness organizations to develop contingency plans, coordinate response efforts, and ensure the continuity of blood donation services during emergencies, natural disasters, or other crisis situations?"
2056,What role do donor engagement events and activities play in prioritizing donor retention and loyalty?
2057,"How do blood drive hosts engage with local government agencies, policymakers, and community leaders to advocate for blood donation policies, funding support, and infrastructure development?"
2058,"How do blood drive hosts collaborate with local businesses, retailers, or shopping centers to organize donation-themed shopping events, offer donor discounts or incentives, and integrate blood donation into the consumer experience as a socially responsible activity?"
2059,How do blood transfusion services ensure the traceability and quality of donated blood products from collection to transfusion?
2060,Who sets the recommendations and guidelines for screening donated blood for transfusion-transmissible infections?
2061,"How can blood donation centers collaborate with local healthcare providers and hospitals to prioritize donation among patients and their families, and how can donation programs be integrated into patient care pathways?"
2062,How does the program collaborate with other health promotion initiatives or campaigns to integrate blood donation messaging into broader youth health agendas?
2063,"Question 19 What strategies can be employed to cultivate a sense of belonging and community among blood donors, fostering long-term commitment and retention?"
2064,How can individuals benefit from consuming more fermented foods for donation?
2065,What measures are in place to encourage repeat donations and foster donor loyalty?
2066,"What strategies can blood donation centers employ to attract and retain younger donors, such as millennials and Generation Z?"
2067,How can blood donation centers effectively integrate appointment reminder messages into their overall donor communication and engagement strategies?
2068,How can universities collaborate with local media outlets to raise awareness about blood donation campaigns and amplify their reach in the community?
2069,"How do blood donation organizations collaborate with government agencies, public health authorities, and regulatory bodies to develop and implement policies and guidelines that ensure the safety, quality, and integrity of the blood supply?"
2070,How does the prevalence of non-communicable diseases such as cancer and diabetes impact the demand for blood transfusions in Africa?
2071,How can universities collaborate with local businesses or corporations to organize blood donation events and raise awareness in the broader community?
2072,What role do medical professionals play in supporting the blood donation process?
2073,How can an online blood donation management system help address disparities in blood donation access and participation?
2074,How can mobile donation units improve access to blood donation in remote areas?
2075,How do cultural practices such as traditional medicine or ritualistic healing impact perceptions of blood donation in Africa?
2076,"How can blood donation programs in Dar es salaam, Tanzania, prioritize motivations and deterrents to encourage sustained donor engagement and address shortages?"
2077,What are the two anesthetic protocols compared in the study on feline blood donation?
2078,How do blood donation centers address challenges related to appointment reminder delivery and accessibility?
2079,How can donating blood support cancer patients?
2080,"What strategies can be implemented to encourage donation among individuals who may have previously been deferred due to temporary eligibility restrictions, and how can donation centers provide support and guidance to facilitate their return to donation?"
2081,How do perceptions of blood donation as a form of activism or advocacy influence donation behavior among socially conscious individuals?
2082,How can individuals benefit from increasing their intake of tomatoes for donation?
2083,"What role do community and social networks play in prioritizing blood donation efforts, and how can they be leveraged to recruit and retain donors?"
2084,How can blood donation help individuals manage anxiety?
2085,How do blood donation drives organized by educational institutions and workplaces contribute to maintaining blood reserves during the pandemic?
2086,What strategies are employed to promote long-term engagement and retention of youth donors?
2087,What is automated blood collection (ABC)?
2088,How does the program measure the effectiveness of its efforts in promoting blood donation among youth?
2089,What role do school-based education and outreach programs play in promoting blood donation awareness and participation among youth?
2090,How do blood drive hosts engage with online communities and social media influencers to amplify donation messages and reach a wider audience?
2091,"What role can volunteer networks and community ambassadors play in promoting blood donation awareness, organizing donation events, and recruiting new donors?"
2092,What strategies can blood donation organizations employ to engage with individuals who have recovered from COVID-19 and encourage them to donate convalescent plasma to help other patients with the virus?
2093,What initiatives can be implemented to encourage regular repeat blood donations among eligible donors in Africa?
2094,How can blood donation facilitation programs leverage data analytics and predictive modeling to anticipate donor behavior and optimize outreach and engagement efforts?
2095,"How do blood donation facilitation programs tailor their outreach efforts to target specific demographic groups, such as young adults, seniors, or minority communities?"
2096,How can individuals benefit from increasing their intake of fiber before donation?
2097,How do blood donation centers ensure the equitable distribution of donated blood products among different healthcare facilities and regions?
2098,"What strategies can blood donation centers use to encourage first-time donors to become regular, lifelong donors?"
2099,How can blood donation impact individuals with respiratory conditions?
2100,What role does donor feedback play in optimizing appointment scheduling processes at blood donation centers?
2101,"How do blood donation centers ensure the ethical and responsible use of donated blood products, including appropriate allocation and transfusion practices?"
2102,"How do blood donation programs address the specific needs and preferences of donors from individuals, and ensure inclusivity, dignity, and respect in donation processes?"
2103,How can blood donation centers engage with faith-based organizations and religious leaders to promote blood donation as an act of compassion and altruism?
2104,How do blood donation facilitation programs measure the effectiveness of their outreach and engagement efforts?
2105,How can health organizations create a positive donation experience for female health care professionals?
2106,"What strategies can blood donation organizations use to engage with younger donors, such as millennials and Gen Z, and encourage them to become regular blood donors?"
2107,How can donating blood impact individuals with asthma?
2108,What are the potential benefits of implementing digital platforms and online registration systems for blood donation?
2109,"How do blood donation organizations address barriers to donation, such as fear of needles, time constraints, and lack of awareness, to encourage more people to participate in donation drives?"
2110,What innovative technologies are being explored to improve blood storage and extend the shelf life of blood products?
2111,How do blood transfusion services in Africa manage the logistics of blood transportation and delivery in challenging environments?
2112,"What role do mobile blood donation units play in reaching underserved or remote areas, and how do blood donation organizations coordinate mobile donation drives to ensure efficient use of resources and maximize impact?"
2113,What role does data analysis and predictive modeling play in optimizing appointment scheduling for blood donation centers?
2114,How does an online blood donation management system support donor engagement and retention?
2115,What strategies can blood donation centers employ to accommodate donors with special needs or accessibility requirements within appointment scheduling systems?
2116,How do cultural attitudes towards blood and health influence blood donation behavior among different ethnic groups?
2117,How do blood drive hosts ensure the safety and efficiency of the donation process?
2118,What steps can donors take to minimize the risk of adverse reactions during the blood donation process?
2119,How can public health campaigns integrate blood donation awareness effectively?
2120,"How do blood donation centers collaborate with healthcare providers, hospitals, and medical professionals to ensure timely access to blood products for patient care needs?"
2121,"Question 36 What measures can be taken to ensure the safety and well-being of blood donors, particularly during public health emergencies such as pandemics or natural disasters?"
2122,"What role can peer mentoring programs and donor support networks play in providing guidance, encouragement, and assistance to new or hesitant donors?"
2123,Question 9 What are the long-term implications of blood shortages and inadequate transfusion services on public health in Africa?
2124,How can community leaders support blood donation campaigns and outreach?
2125,What strategies can be implemented to encourage regular blood donation among existing donors and foster a sense of ongoing commitment to donation?
2126,How can blood donation centers address donor privacy concerns when sending appointment reminders?
